{
  "controller": "osram_ac025xx00nj",
  "library_id": "EPMatt",
  "release_id": "awesome",
  "hooks": [
    {
      "hook": "light",
      "label": "Light",
      "mapping_options": [
        {
          "id": "default",
          "label": "Default",
          "mappings": [
            {
              "event": "button_up_short",
              "event_label": "Up button short press",
              "action": "brightness_up",
              "action_label": "Brightness up",
              "mode": "single"
            },
            {
              "event": "button_up_long",
              "event_label": "Up button long press",
              "action": "brightness_up_repeat",
              "action_label": "Brightness up (continuous, until release)",
              "mode": "continuous"
            },
            {
              "event": "button_up_double",
              "event_label": "Up button double press",
              "action": "color_up",
              "action_label": "Color up",
              "mode": "single",
              "virtual": true
            },
            {
              "event": "button_down_short",
              "event_label": "Down button short press",
              "action": "brightness_down",
              "action_label": "Brightness down",
              "mode": "single"
            },
            {
              "event": "button_down_long",
              "event_label": "Down button long press",
              "action": "brightness_down_repeat",
              "action_label": "Brightness down (continuous, until release)",
              "mode": "continuous"
            },
            {
              "event": "button_down_double",
              "event_label": "Down button double press",
              "action": "color_down",
              "action_label": "Color down",
              "mode": "single",
              "virtual": true
            },
            {
              "event": "button_center_short",
              "event_label": "Center button short press",
              "action": "toggle",
              "action_label": "Toggle",
              "mode": "single"
            }
          ]
        }
      ]
    },
    {
      "hook": "media_player",
      "label": "Media Player",
      "mapping_options": [
        {
          "id": "default",
          "label": "Default",
          "mappings": [
            {
              "event": "button_up_short",
              "event_label": "Up button short press",
              "action": "volume_up",
              "action_label": "Volume up",
              "mode": "single"
            },
            {
              "event": "button_up_long",
              "event_label": "Up button long press",
              "action": "volume_up_repeat",
              "action_label": "Volume up (continuous, until release)",
              "mode": "continuous"
            },
            {
              "event": "button_up_double",
              "event_label": "Up button double press",
              "action": "next_track",
              "action_label": "Next track",
              "mode": "single",
              "virtual": true
            },
            {
              "event": "button_down_short",
              "event_label": "Down button short press",
              "action": "volume_down",
              "action_label": "Volume down",
              "mode": "single"
            },
            {
              "event": "button_down_long",
              "event_label": "Down button long press",
              "action": "volume_down_repeat",
              "action_label": "Volume down (continuous, until release)",
              "mode": "continuous"
            },
            {
              "event": "button_down_double",
              "event_label": "Down button double press",
              "action": "prev_track",
              "action_label": "Previous track",
              "mode": "single",
              "virtual": true
            },
            {
              "event": "button_center_short",
              "event_label": "Center button short press",
              "action": "play_pause",
              "action_label": "Play/Pause",
              "mode": "single"
            },
            {
              "event": "button_center_long",
              "event_label": "Center button long press",
              "action": "toggle",
              "action_label": "Toggle",
              "mode": "single"
            }
          ]
        }
      ]
    }
  ]
}
