{
  "controller": "ikea_ictc_g_1",
  "library_id": "EPMatt",
  "release_id": "awesome",
  "hooks": [
    {
      "hook": "light",
      "label": "Light",
      "mapping_options": [
        {
          "id": "default",
          "label": "Default",
          "mappings": [
            {
              "event": "rotate_left",
              "event_label": "Rotate left",
              "action": "brightness_down_repeat",
              "action_label": "Brightness down (continuous, until release)",
              "mode": "continuous"
            },
            {
              "event": "rotate_right",
              "event_label": "Rotate right",
              "action": "brightness_up_repeat",
              "action_label": "Brightness up (continuous, until release)",
              "mode": "continuous"
            }
          ]
        }
      ]
    },
    {
      "hook": "media_player",
      "label": "Media Player",
      "mapping_options": [
        {
          "id": "default",
          "label": "Default",
          "mappings": [
            {
              "event": "rotate_left",
              "event_label": "Rotate left",
              "action": "volume_down_repeat",
              "action_label": "Volume down (continuous, until release)",
              "mode": "continuous"
            },
            {
              "event": "rotate_right",
              "event_label": "Rotate right",
              "action": "volume_up_repeat",
              "action_label": "Volume up (continuous, until release)",
              "mode": "continuous"
            }
          ]
        }
      ]
    }
  ]
}
