{
  "controller": "ikea_e1744",
  "library_id": "EPMatt",
  "release_id": "awesome",
  "hooks": [
    {
      "hook": "light",
      "label": "Light",
      "mapping_options": [
        {
          "id": "default",
          "label": "Default",
          "mappings": [
            {
              "event": "rotate_left",
              "event_label": "Rotate left",
              "action": "brightness_down_repeat",
              "action_label": "Brightness down (continuous, until release)",
              "mode": "continuous"
            },
            {
              "event": "rotate_right",
              "event_label": "Rotate right",
              "action": "brightness_up_repeat",
              "action_label": "Brightness up (continuous, until release)",
              "mode": "continuous"
            },
            {
              "event": "click_short",
              "event_label": "Remote short press",
              "action": "toggle",
              "action_label": "Toggle",
              "mode": "single"
            },
            {
              "event": "click_double",
              "event_label": "Remote double press",
              "action": "color_up",
              "action_label": "Color up",
              "mode": "single"
            },
            {
              "event": "click_triple",
              "event_label": "Remote triple press",
              "action": "color_down",
              "action_label": "Color down",
              "mode": "single"
            }
          ]
        }
      ]
    },
    {
      "hook": "media_player",
      "label": "Media Player",
      "mapping_options": [
        {
          "id": "default",
          "label": "Default",
          "mappings": [
            {
              "event": "rotate_left",
              "event_label": "Rotate left",
              "action": "volume_down_repeat",
              "action_label": "Volume down (continuous, until release)",
              "mode": "continuous"
            },
            {
              "event": "rotate_right",
              "event_label": "Rotate right",
              "action": "volume_up_repeat",
              "action_label": "Volume up (continuous, until release)",
              "mode": "continuous"
            },
            {
              "event": "click_short",
              "event_label": "Remote short press",
              "action": "play_pause",
              "action_label": "Play/Pause",
              "mode": "single"
            },
            {
              "event": "click_double",
              "event_label": "Remote double press",
              "action": "next_track",
              "action_label": "Next track",
              "mode": "single"
            },
            {
              "event": "click_triple",
              "event_label": "Remote triple press",
              "action": "prev_track",
              "action_label": "Previous track",
              "mode": "single"
            }
          ]
        }
      ]
    }
  ]
}
