{
  "controller": "shelly_button_1",
  "library_id": "EPMatt",
  "release_id": "awesome",
  "hooks": [
    {
      "hook": "cover",
      "label": "Cover",
      "mapping_options": [
        {
          "id": "default",
          "label": "Default",
          "mappings": [
            {
              "event": "button_button_short",
              "event_label": "Button button short press",
              "action": "open_cover",
              "action_label": "Open cover",
              "mode": "single"
            },
            {
              "event": "button_button_double",
              "event_label": "Button button double press",
              "action": "close_cover",
              "action_label": "Close cover",
              "mode": "single"
            },
            {
              "event": "button_button_long",
              "event_label": "Button button long press",
              "action": "stop_cover_all",
              "action_label": "Stop cover and cover tilt",
              "mode": "single"
            }
          ]
        }
      ]
    },
    {
      "hook": "light",
      "label": "Light",
      "mapping_options": [
        {
          "id": "default",
          "label": "Default",
          "mappings": [
            {
              "event": "button_button_short",
              "event_label": "Button button short press",
              "action": "toggle",
              "action_label": "Toggle",
              "mode": "single"
            },
            {
              "event": "button_button_double",
              "event_label": "Button button double press",
              "action": "brightness_up",
              "action_label": "Brightness up",
              "mode": "single"
            },
            {
              "event": "button_button_triple",
              "event_label": "Button button triple press",
              "action": "brightness_down",
              "action_label": "Brightness down",
              "mode": "single"
            },
            {
              "event": "button_button_long",
              "event_label": "Button button long press",
              "action": "brightness_up_repeat",
              "action_label": "Brightness up (continuous, until release)",
              "mode": "continuous"
            }
          ]
        }
      ]
    },
    {
      "hook": "media_player",
      "label": "Media Player",
      "mapping_options": [
        {
          "id": "default",
          "label": "Default",
          "mappings": [
            {
              "event": "button_button_short",
              "event_label": "Button button short press",
              "action": "play_pause",
              "action_label": "Play/Pause",
              "mode": "single"
            },
            {
              "event": "button_button_double",
              "event_label": "Button button double press",
              "action": "next_track",
              "action_label": "Next track",
              "mode": "single"
            },
            {
              "event": "button_button_triple",
              "event_label": "Button button triple press",
              "action": "prev_track",
              "action_label": "Previous track",
              "mode": "single"
            },
            {
              "event": "button_button_long",
              "event_label": "Button button long press",
              "action": "stop",
              "action_label": "Stop",
              "mode": "single"
            }
          ]
        }
      ]
    }
  ]
}
